{
  "manifest_version": "1.0",
  "manifest_id": "metropt-compressor-fixture-v1",
  "organization_id": "org-ontology-demo",
  "project_id": "metropt-compressor-project",
  "workspace_id": "metropt-compressor-monitoring",
  "adapter_code": "metropt-compressor-monitoring",
  "dataset_name": "MetroPT Compressor Fixture",
  "dataset_version": "fixture-v1",
  "license": "Synthetic test fixture",
  "provenance_url": null,
  "source": {
    "uri": "data/fixtures/adapters/metropt-compressor-fixture.csv",
    "media_type": "text/csv",
    "checksum_sha256": "29f305e0408f9f17237284102e8ff726877d50e5f2e467c6063d1303def82874",
    "size_bytes": 345,
    "encoding": "utf-8"
  },
  "schema": {
    "format": "csv",
    "required_fields": ["timestamp", "TP2"],
    "field_aliases": {
      "timestamp": ["datetime", "Timestamp"]
    },
    "primary_key": ["timestamp"],
    "timestamp_field": "timestamp",
    "timezone": "UTC"
  },
  "quality_rules": [
    {
      "code": "metropt.timestamp.required",
      "field": "timestamp",
      "rule": "required",
      "value": null
    },
    {
      "code": "metropt.tp2.number",
      "field": "TP2",
      "rule": "number",
      "value": null
    }
  ],
  "created_at": "2026-08-01T00:00:00Z"
}
