{
  "manifest_version": "1.0",
  "manifest_id": "azure-fleet-maintenance-fixture-v1",
  "organization_id": "org-ontology-demo",
  "project_id": "azure-fleet-maintenance-project",
  "workspace_id": "azure-fleet-maintenance",
  "adapter_code": "azure-fleet-maintenance",
  "dataset_name": "Azure Fleet Maintenance Fixture",
  "dataset_version": "fixture-v1",
  "license": "Synthetic test fixture",
  "provenance_url": null,
  "source": {
    "uri": "data/fixtures/adapters/azure-fleet-maintenance-fixture.csv",
    "media_type": "text/csv",
    "checksum_sha256": "671f64b3267cdb586fc67da7a30349504afa5c929a267ae97564e8a002024873",
    "size_bytes": 299,
    "encoding": "utf-8"
  },
  "schema": {
    "format": "csv",
    "required_fields": ["datetime", "machineID"],
    "field_aliases": {
      "datetime": ["timestamp", "observed_at"],
      "machineID": ["machine_id", "equipment_id"]
    },
    "primary_key": ["datetime", "machineID"],
    "timestamp_field": "datetime",
    "timezone": "UTC"
  },
  "quality_rules": [
    {
      "code": "azure.datetime.required",
      "field": "datetime",
      "rule": "required",
      "value": null
    },
    {
      "code": "azure.machine.required",
      "field": "machineID",
      "rule": "required",
      "value": null
    }
  ],
  "created_at": "2026-08-01T00:00:00Z"
}
